{
  "$schema": "https://json-schema.org/draft/2020-12/schema",
  "$id": "https://rota-saude/schemas/protocol-definition.json",
  "title": "Protocol Definition",
  "description": "Contrato compartilhado por motor Ruby (ADR-0013) e preview TS (ADR-0016).",
  "type": "object",
  "required": ["name", "version", "start_step_id", "steps"],
  "additionalProperties": false,
  "properties": {
    "name": {
      "type": "string",
      "pattern": "^[a-z][a-z0-9-]+$",
      "description": "Identificador estável do protocolo, ex.: triagem-respiratoria"
    },
    "version": { "type": "integer", "minimum": 1 },
    "schema_version": { "type": "integer", "minimum": 1, "default": 1 },
    "start_step_id": { "type": "string" },
    "steps": {
      "type": "array",
      "minItems": 1,
      "items": { "$ref": "#/$defs/step" }
    },
    "scoring": {
      "oneOf": [
        { "$ref": "#/$defs/scoring_weighted" },
        { "$ref": "#/$defs/scoring_decision_table" }
      ]
    },
    "recommendations": {
      "type": "object",
      "description": "tier -> { title, body }. Optional. Author-defined health advice per tier.",
      "additionalProperties": {
        "type": "object",
        "required": ["title", "body"],
        "additionalProperties": false,
        "properties": {
          "title": { "type": "string" },
          "body":  { "type": "string" }
        }
      }
    },
    "priority_when": {
      "type": "array",
      "items": {
        "type": "object",
        "required": ["when", "priority"],
        "additionalProperties": false,
        "properties": {
          "when": {
            "oneOf": [
              { "type": "object", "minProperties": 1, "additionalProperties": { "type": "string" } },
              { "$ref": "#/$defs/condition" }
            ]
          },
          "priority": { "type": "integer", "minimum": 1, "maximum": 9 }
        }
      }
    },
    "offer": {
      "type": "object",
      "additionalProperties": false,
      "properties": {
        "title":             { "type": "string", "minLength": 1, "maxLength": 60 },
        "summary":           { "type": "string", "minLength": 1, "maxLength": 200 },
        "eligibility":       { "$ref": "#/$defs/condition" },
        "retake_after_days": { "type": "integer", "minimum": 1, "maximum": 3650 }
      }
    },
    "suggestions": {
      "type": "array",
      "maxItems": 10,
      "items": {
        "type": "object",
        "additionalProperties": false,
        "required": ["protocol", "when"],
        "properties": {
          "protocol": { "type": "string", "pattern": "^[a-z][a-z0-9-]+$" },
          "when":     { "$ref": "#/$defs/condition" }
        }
      }
    }
  },
  "$defs": {
    "step": {
      "type": "object",
      "required": ["id", "prompt", "answer_type"],
      "additionalProperties": false,
      "properties": {
        "id":          { "type": "string" },
        "prompt":      { "type": "string" },
        "answer_type": { "enum": ["boolean", "enum", "integer", "text"] },
        "options": {
          "type": "array",
          "items": { "type": "string" },
          "description": "Obrigatório quando answer_type=enum"
        },
        "branches": {
          "type": "object",
          "additionalProperties": {
            "oneOf": [
              { "type": "string" },
              { "type": "null" }
            ]
          },
          "description": "answer_value -> next_step_id (null = terminal)"
        },
        "weights": {
          "type": "object",
          "additionalProperties": { "type": "integer" },
          "description": "answer_value -> peso numérico (usado por scoring weighted)"
        },
        "analytic": {
          "type": "boolean",
          "description": "Usar em Analytics (ADR 0025): respostas agregadas por bairro, nunca por pessoa. Só boolean e enum."
        }
      },
      "allOf": [
        {
          "if": {
            "required": ["analytic"],
            "properties": { "analytic": { "const": true } }
          },
          "then": {
            "properties": { "answer_type": { "enum": ["boolean", "enum"] } }
          }
        },
        {
          "if": {
            "required": ["answer_type"],
            "properties": { "answer_type": { "const": "enum" } }
          },
          "then": {
            "required": ["options"],
            "properties": { "options": { "minItems": 1 } }
          }
        }
      ]
    },
    "scoring_weighted": {
      "type": "object",
      "required": ["type", "thresholds"],
      "additionalProperties": false,
      "properties": {
        "type": { "const": "weighted" },
        "thresholds": {
          "type": "object",
          "minProperties": 1,
          "additionalProperties": { "type": "integer" }
        },
        "priority_map": {
          "type": "object",
          "additionalProperties": { "type": "integer", "minimum": 1, "maximum": 9 }
        }
      }
    },
    "scoring_decision_table": {
      "type": "object",
      "required": ["type", "rules"],
      "additionalProperties": false,
      "properties": {
        "type": { "const": "decision_table" },
        "rules": {
          "type": "array",
          "minItems": 1,
          "items": {
            "type": "object",
            "required": ["when", "tier", "priority"],
            "additionalProperties": false,
            "properties": {
              "when": {
                "oneOf": [
                  { "type": "object", "minProperties": 1, "additionalProperties": { "type": "string" } },
                  { "$ref": "#/$defs/condition" }
                ]
              },
              "tier":     { "type": "string" },
              "priority": { "type": "integer", "minimum": 1, "maximum": 9 }
            }
          }
        },
        "fallback": {
          "type": "object",
          "required": ["tier", "priority"],
          "additionalProperties": false,
          "properties": {
            "tier":     { "type": "string" },
            "priority": { "type": "integer", "minimum": 1, "maximum": 9 }
          }
        }
      }
    },
    "condition_operand": {
      "type": "array",
      "prefixItems": [{ "type": "string" }, { "type": ["string", "number"] }],
      "minItems": 2,
      "maxItems": 2
    },
    "condition": {
      "type": "object",
      "minProperties": 1,
      "maxProperties": 1,
      "oneOf": [
        { "required": ["eq"], "additionalProperties": false, "properties": { "eq": { "$ref": "#/$defs/condition_operand" } } },
        { "required": ["gt"], "additionalProperties": false, "properties": { "gt": { "$ref": "#/$defs/condition_operand" } } },
        { "required": ["lt"], "additionalProperties": false, "properties": { "lt": { "$ref": "#/$defs/condition_operand" } } },
        { "required": ["gte"], "additionalProperties": false, "properties": { "gte": { "$ref": "#/$defs/condition_operand" } } },
        { "required": ["lte"], "additionalProperties": false, "properties": { "lte": { "$ref": "#/$defs/condition_operand" } } },
        { "required": ["in"], "additionalProperties": false, "properties": { "in": { "type": "array", "prefixItems": [{ "type": "string" }, { "type": "array" }], "minItems": 2, "maxItems": 2 } } },
        { "required": ["all"], "additionalProperties": false, "properties": { "all": { "type": "array", "minItems": 1, "items": { "$ref": "#/$defs/condition" } } } },
        { "required": ["any"], "additionalProperties": false, "properties": { "any": { "type": "array", "minItems": 1, "items": { "$ref": "#/$defs/condition" } } } },
        { "required": ["not"], "additionalProperties": false, "properties": { "not": { "$ref": "#/$defs/condition" } } }
      ]
    }
  }
}
